{"effect_lineage_id":"lin-294ae219c8b18882ae7ea7e3ce28c2c71c921e1686cc254e","event_id":"lineage-root-activated-8e17d5977003e0866fcfa4996fcdf1ed","event_type":"lineage.root-activated","occurred_at":"2026-10-02T11:19:05Z","payload":{"semantic_effect_key":"16be58789856d4c0b3418f089fedff865c23ddc55e8cf5a0e2795e16b633bc78"},"schema_version":"ai-sdlc.effect-lineage-event/v1","sequence":1,"trusted_context_digest":"599a11eafbcf25412bbbe41df60f3801744bfcb8ca27848700ed58bca6966107"}
