{"effect_lineage_id":"lin-871cb66afbb024e4a6b61e2ba3ac3176cba0cfde43620f12","event_id":"lineage-root-activated-55ba75ccd8d2e0dca6c488c0c60a9156","event_type":"lineage.root-activated","occurred_at":"2026-10-02T12:00:32Z","payload":{"semantic_effect_key":"51b2dfbc4623c520e75b7f6f950fe8d5d144136012ddca16c947027adce78f5d"},"schema_version":"ai-sdlc.effect-lineage-event/v1","sequence":1,"trusted_context_digest":"cf8beaa0979c36f88c229e635d733747493fe51e6bf7134869c4d55b2b66fd95"}
