{"effect_lineage_id":"lin-b54c9234eccd798d8694f8446a95682ba4cfab0b4766bda0","event_id":"lineage-root-activated-5d8b09cb2cd898bfd15e0331fd989de7","event_type":"lineage.root-activated","occurred_at":"2026-10-02T15:45:04Z","payload":{"semantic_effect_key":"dbe87775c7fee96d2a7229e18bb78126fc988a1dced35aa87bd14a7e870e6ea2"},"schema_version":"ai-sdlc.effect-lineage-event/v1","sequence":1,"trusted_context_digest":"4a925fbc7cfb719f649ebc9295cca506a7879606f9164fe28519ff1f5a2f5707"}
