{"effect_lineage_id":"lin-0c077e9eae8dfc9592a69c49ec36cfd7ea7beb7f5efe4ba8","event_id":"lineage-root-activated-72eb8f3c4a6e17aec20abc128f94a00d","event_type":"lineage.root-activated","occurred_at":"2026-10-02T14:42:08Z","payload":{"semantic_effect_key":"fc3138584cdd444592d14e26e69855b0bbab94bb36dbfcecb2d1e574f3ed42b8"},"schema_version":"ai-sdlc.effect-lineage-event/v1","sequence":1,"trusted_context_digest":"d80ef035cb5409caf7958cdf18dedeb3365abdfb40e5ed2ec2104cbf5758a28c"}
