{"effect_lineage_id":"lin-649e0cb09f4e9bd78960b143769ce6124ff6d160607b7f26","event_id":"lineage-root-activated-b51938d14fe7ee03f30d235d6bee76f0","event_type":"lineage.root-activated","occurred_at":"2026-09-26T08:11:49Z","payload":{"semantic_effect_key":"8a858c27ba71e631ca0cc521752ad72bb92468e0f0970d24bc60bfc110f6fe7b"},"schema_version":"ai-sdlc.effect-lineage-event/v1","sequence":1,"trusted_context_digest":"1eb9ced6c4358a54cb25ca834db81037080f4f9ccaf1bc1318335b2c2d8e702a"}
