{"effect_lineage_id":"lin-3df2eabbf74abadf16c4e08c02e568e0e77e15d38980c30d","event_id":"lineage-root-activated-8a2c8d808f61b9fa0a7d40f3807008f3","event_type":"lineage.root-activated","occurred_at":"2026-09-29T07:30:41Z","payload":{"semantic_effect_key":"916f6b349d987457518f6fd5de53dea834a93418372d9761659e3111ab228f0e"},"schema_version":"ai-sdlc.effect-lineage-event/v1","sequence":1,"trusted_context_digest":"8fabfd42106a284b6a83b23a1979d22bbc8a44292d8d51c9fd5c2824fea616e6"}
