{"effect_lineage_id":"lin-b4ba1f2a16cdf7441b693bb1268be1d9dac1316a20370937","event_id":"lineage-root-activated-d1b478163fe77ff2c97560f55b70ce11","event_type":"lineage.root-activated","occurred_at":"2026-09-27T14:16:19Z","payload":{"semantic_effect_key":"78d09c9e7f7d7dc66b619295094524d8589f3c53eb4c7a10e873273f7297d1c8"},"schema_version":"ai-sdlc.effect-lineage-event/v1","sequence":1,"trusted_context_digest":"28c795bfbfa5f955a10219c72f66e079c6220261e91ffd820b949c7cd9b54fb5"}
