{"effect_lineage_id":"lin-20d9cd283cd06341ca9a2a5e83dec7cfdc8dd0591159c0be","event_id":"lineage-root-activated-38195374b612c87d6909a1bb2809b0af","event_type":"lineage.root-activated","occurred_at":"2026-09-27T07:21:21Z","payload":{"semantic_effect_key":"a472bea524eb09de0605930cdbb418ad5346849b1321824ddee43c44c6233bc2"},"schema_version":"ai-sdlc.effect-lineage-event/v1","sequence":1,"trusted_context_digest":"4d46fe2babbe36a280f2240ee4807a1b634cd59510078c3e82bd47a6d66d46e6"}
