{"effect_lineage_id":"lin-fb93b0a58c944a2d5e86c8f8808a0b4aefb11531fdf05add","event_id":"lineage-root-activated-8115a55489f24db5933bfc324de262d1","event_type":"lineage.root-activated","occurred_at":"2026-09-25T15:38:40Z","payload":{"semantic_effect_key":"ae87056bc083b7dfd0d6c79a1bf1d9f194112afec92f4fe57267cfcd7d6ecee6"},"schema_version":"ai-sdlc.effect-lineage-event/v1","sequence":1,"trusted_context_digest":"92207843a3de57b3f9231ca964dc01cca85f4def71d4d84ec653e0e7416f864f"}
