{"effect_lineage_id":"lin-0d9e8d36082a56742c269f56c79b6ec660f0d00707655c1a","event_id":"lineage-root-activated-c1e559d2fbd7e06dad76d687d0165bfa","event_type":"lineage.root-activated","occurred_at":"2026-10-02T11:41:09Z","payload":{"semantic_effect_key":"037ec5f8e00ab3c5a5f927d764d0c66750ca2f6c1d2ffa2959041b4fdcc535da"},"schema_version":"ai-sdlc.effect-lineage-event/v1","sequence":1,"trusted_context_digest":"5809edf5eec44c3bcaba7ec75ee24d98f644daefe6710458a6652e0c1ba45ddb"}
