{"effect_lineage_id":"lin-38e174f1a5cb6d3efb5126db2f5cbb406a15c1dcbdf166d1","event_id":"lineage-root-activated-9af5378051def2d1f02566f95a10f1e9","event_type":"lineage.root-activated","occurred_at":"2026-09-26T11:11:01Z","payload":{"semantic_effect_key":"2727c2da787c99a5bd6de338dfb2806ee4cc288973842b146b004b6953db2a71"},"schema_version":"ai-sdlc.effect-lineage-event/v1","sequence":1,"trusted_context_digest":"416c4fba42ff7cabed3b67c9f1939ef515584a055d800cbf43c2821ee50c37b1"}
