{"effect_lineage_id":"lin-9a383d3ad6763979fd38e00de2dae38272c43454e727d018","event_id":"lineage-root-activated-6d8abf7a65d939c825e0ff22ca8ba681","event_type":"lineage.root-activated","occurred_at":"2026-10-02T12:43:13Z","payload":{"semantic_effect_key":"f67531e6e71acf46d4d20e541b597d595cd3e611bc38f055c59fd72c4ca14ec8"},"schema_version":"ai-sdlc.effect-lineage-event/v1","sequence":1,"trusted_context_digest":"41740bc4cda0968f7bb967576111727343f23313272a2a3c01d8ca8546d9617b"}
